{
  "version": "2.0.0",
  "last_sync": "2026-01-28T22:24:06.554634+00:00",
  "shopify_store": "bmcuruguay.myshopify.com",
  "products": {
    "IAGRO30": {
      "name": "Isoroof FOIL 30 mm - Color Gris-Rojo",
      "sku": "IAGRO30",
      "category": "ISOROOF / FOIL",
      "subcategory": "PIR",
      "type": "Panel",
      "price_per_m2": 39.48,
      "price_details": {
        "cost_sin_iva": 28.14,
        "sale_sin_iva": 32.36,
        "sale_iva_inc": 39.48
      },
      "currency": "USD",
      "specifications": {
        "thickness_mm": 30.0,
        "length_m": "on demand",
        "unit_base": "m2",
        "largo_min_max": "3.5 / 14"
      },
      "calculation_rules": {
        "minimum_order_m2": 10,
        "bulk_discount_threshold_m2": 100,
        "bulk_discount_percent": 5
      },
      "last_updated": "2026-01-28T22:24:06.554437+00:00"
    },
    "IAGRO50": {
      "name": "Isoroof FOIL 50 mm - Color Rojo-Gris",
      "sku": "IAGRO50",
      "category": "ISOROOF / FOIL",
      "subcategory": "PIR",
      "type": "Panel",
      "price_per_m2": 44.76,
      "price_details": {
        "cost_sin_iva": 31.9,
        "sale_sin_iva": 36.69,
        "sale_iva_inc": 44.76
      },
      "currency": "USD",
      "specifications": {
        "thickness_mm": 50.0,
        "length_m": "on demand",
        "unit_base": "m2",
        "largo_min_max": "3.5 / 14"
      },
      "calculation_rules": {
        "minimum_order_m2": 10,
        "bulk_discount_threshold_m2": 100,
        "bulk_discount_percent": 5
      },
      "last_updated": "2026-01-28T22:24:06.554461+00:00"
    },
    "IROOF30": {
      "name": "Isoroof 30 mm Terracota o Gris",
      "sku": "IROOF30",
      "category": "ISOROOF",
      "subcategory": "PIR",
      "type": "Panel",
      "price_per_m2": 48.74,
      "price_details": {
        "cost_sin_iva": 34.74,
        "sale_sin_iva": 39.95,
        "sale_iva_inc": 48.74
      },
      "currency": "USD",
      "specifications": {
        "thickness_mm": 30.0,
        "length_m": "on demand",
        "unit_base": "m2",
        "largo_min_max": "3.5 / 14"
      },
      "calculation_rules": {
        "minimum_order_m2": 10,
        "bulk_discount_threshold_m2": 100,
        "bulk_discount_percent": 5
      },
      "last_updated": "2026-01-28T22:24:06.554464+00:00"
    },
    "IROOF40": {
      "name": "Isoroof 40 mm Terracota o Gris",
      "sku": "IROOF40",
      "category": "ISOROOF",
      "subcategory": "PIR",
      "type": "Panel",
      "price_per_m2": 51.21,
      "price_details": {
        "cost_sin_iva": 36.5,
        "sale_sin_iva": 41.98,
        "sale_iva_inc": 51.21
      },
      "currency": "USD",
      "specifications": {
        "thickness_mm": 40.0,
        "length_m": "on demand",
        "unit_base": "m2",
        "largo_min_max": "3.5 / 14"
      },
      "calculation_rules": {
        "minimum_order_m2": 10,
        "bulk_discount_threshold_m2": 100,
        "bulk_discount_percent": 5
      },
      "last_updated": "2026-01-28T22:24:06.554467+00:00"
    },
    "IROOF50": {
      "name": "Isoroof 50 mm Terracota o Gris",
      "sku": "IROOF50",
      "category": "ISOROOF",
      "subcategory": "PIR",
      "type": "Panel",
      "price_per_m2": 53.68,
      "price_details": {
        "cost_sin_iva": 38.26,
        "sale_sin_iva": 44.0,
        "sale_iva_inc": 53.68
      },
      "currency": "USD",
      "specifications": {
        "thickness_mm": 50.0,
        "length_m": "on demand",
        "unit_base": "m2",
        "largo_min_max": "3.5 / 14"
      },
      "calculation_rules": {
        "minimum_order_m2": 10,
        "bulk_discount_threshold_m2": 100,
        "bulk_discount_percent": 5
      },
      "last_updated": "2026-01-28T22:24:06.554468+00:00"
    },
    "IROOF80": {
      "name": "Isoroof 80 mm - Gris - Rojo",
      "sku": "IROOF80",
      "category": "ISOROOF",
      "subcategory": "PIR",
      "type": "Panel",
      "price_per_m2": 63.11,
      "price_details": {
        "cost_sin_iva": 44.98,
        "sale_sin_iva": 51.73,
        "sale_iva_inc": 63.11
      },
      "currency": "USD",
      "specifications": {
        "thickness_mm": 80.0,
        "length_m": "on demand",
        "unit_base": "m2",
        "largo_min_max": "3.5 / 14"
      },
      "calculation_rules": {
        "minimum_order_m2": 10,
        "bulk_discount_threshold_m2": 100,
        "bulk_discount_percent": 5
      },
      "last_updated": "2026-01-28T22:24:06.554471+00:00"
    },
    "IROOF100": {
      "name": "Isoroof 100 mm - Gris - Rojo",
      "sku": "IROOF100",
      "category": "ISOROOF",
      "subcategory": "PIR",
      "type": "Panel",
      "price_per_m2": 69.29,
      "price_details": {
        "cost_sin_iva": 49.39,
        "sale_sin_iva": 56.8,
        "sale_iva_inc": 69.29
      },
      "currency": "USD",
      "specifications": {
        "thickness_mm": 100.0,
        "length_m": "on demand",
        "unit_base": "m2",
        "largo_min_max": "3.5 / 14"
      },
      "calculation_rules": {
        "minimum_order_m2": 10,
        "bulk_discount_threshold_m2": 100,
        "bulk_discount_percent": 5
      },
      "last_updated": "2026-01-28T22:24:06.554473+00:00"
    },
    "IROOF50-PLS": {
      "name": "Isoroof Plus 50 mm - Gris - Rojo (MINIMO 800 M2)",
      "sku": "IROOF50-PLS",
      "category": "ISOROOF",
      "subcategory": "PIR",
      "type": "Panel",
      "price_per_m2": 61.07,
      "price_details": {
        "cost_sin_iva": 43.53,
        "sale_sin_iva": 50.06,
        "sale_iva_inc": 61.07
      },
      "currency": "USD",
      "specifications": {
        "thickness_mm": 50.0,
        "length_m": "on demand",
        "unit_base": "m2",
        "largo_min_max": "3.5 / 14"
      },
      "calculation_rules": {
        "minimum_order_m2": 10,
        "bulk_discount_threshold_m2": 100,
        "bulk_discount_percent": 5
      },
      "last_updated": "2026-01-28T22:24:06.554475+00:00"
    },
    "IROOF80-PLS": {
      "name": "Isoroof Plus 80 mm - Gris - Rojo",
      "sku": "IROOF80-PLS",
      "category": "ISOROOF",
      "subcategory": "PIR",
      "type": "Panel",
      "price_per_m2": 71.76,
      "price_details": {
        "cost_sin_iva": 51.15,
        "sale_sin_iva": 58.82,
        "sale_iva_inc": 71.76
      },
      "currency": "USD",
      "specifications": {
        "thickness_mm": 80.0,
        "length_m": "on demand",
        "unit_base": "m2",
        "largo_min_max": "3.5 / 14"
      },
      "calculation_rules": {
        "minimum_order_m2": 10,
        "bulk_discount_threshold_m2": 100,
        "bulk_discount_percent": 5
      },
      "last_updated": "2026-01-28T22:24:06.554477+00:00"
    },
    "C.But.": {
      "name": "Cinta Butilo 2mm x 15mm x 22.5m lineales",
      "sku": "C.But.",
      "category": "Estandar",
      "subcategory": "Estandar",
      "type": "Accesorio",
      "price_per_m2": 18.17,
      "price_details": {
        "cost_sin_iva": 12.95,
        "sale_sin_iva": 14.89,
        "sale_iva_inc": 18.17
      },
      "currency": "USD",
      "specifications": {
        "thickness_mm": 2.0,
        "length_m": "22,5",
        "unit_base": "Unit",
        "largo_min_max": "N/A"
      },
      "calculation_rules": {
        "minimum_order_m2": 10,
        "bulk_discount_threshold_m2": 100,
        "bulk_discount_percent": 5
      },
      "last_updated": "2026-01-28T22:24:06.554478+00:00"
    },
    "Cab. Roj": {
      "name": "Caballete Rojo Teja, Gris y blanco- (Arandela Trapezoidal)",
      "sku": "Cab. Roj",
      "category": "ISOROOF",
      "subcategory": "PIR",
      "type": "Anclajes / Fijaciones",
      "price_per_m2": 0.6,
      "price_details": {
        "cost_sin_iva": 0.33,
        "sale_sin_iva": 0.5,
        "sale_iva_inc": 0.6
      },
      "currency": "USD",
      "specifications": {
        "thickness_mm": null,
        "length_m": "N/A",
        "unit_base": "Unit",
        "largo_min_max": "N/A"
      },
      "calculation_rules": {
        "minimum_order_m2": 10,
        "bulk_discount_threshold_m2": 100,
        "bulk_discount_percent": 5
      },
      "last_updated": "2026-01-28T22:24:06.554480+00:00"
    },
    "Bromplast": {
      "name": "Bromplast 8 - Silicona Neutra  X 600",
      "sku": "Bromplast",
      "category": "Estandar",
      "subcategory": "Estandar",
      "type": "Accesorio",
      "price_per_m2": 11.58,
      "price_details": {
        "cost_sin_iva": 7.91,
        "sale_sin_iva": 9.49,
        "sale_iva_inc": 11.58
      },
      "currency": "USD",
      "specifications": {
        "thickness_mm": null,
        "length_m": "N/A",
        "unit_base": "Unit",
        "largo_min_max": "N/A"
      },
      "calculation_rules": {
        "minimum_order_m2": 10,
        "bulk_discount_threshold_m2": 100,
        "bulk_discount_percent": 5
      },
      "last_updated": "2026-01-28T22:24:06.554481+00:00"
    },
    "GFS30": {
      "name": "Gotero Frontal Simple 30mm Prep.",
      "sku": "GFS30",
      "category": "ISOROOF",
      "subcategory": "GOTERO FRONTAL PREPINTADO",
      "type": "Perfileria / Terminaciones",
      "price_per_m2": 19.31,
      "price_details": {
        "cost_sin_iva": 13.19,
        "sale_sin_iva": 15.83,
        "sale_iva_inc": 19.31
      },
      "currency": "USD",
      "specifications": {
        "thickness_mm": 30.0,
        "length_m": "3.03",
        "unit_base": "Unit",
        "largo_min_max": "3.03"
      },
      "calculation_rules": {
        "minimum_order_m2": 10,
        "bulk_discount_threshold_m2": 100,
        "bulk_discount_percent": 5
      },
      "last_updated": "2026-01-28T22:24:06.554483+00:00"
    },
    "GFS50": {
      "name": "Gotero Frontal Simple 50mm Prep.",
      "sku": "GFS50",
      "category": "ISOROOF",
      "subcategory": "GOTERO FRONTAL PREPINTADO",
      "type": "Perfileria / Terminaciones",
      "price_per_m2": 20.45,
      "price_details": {
        "cost_sin_iva": 13.97,
        "sale_sin_iva": 16.76,